{
  "schema_version": 2,
  "status": "ok",
  "time_context": {
    "input": {
      "subject": {
        "birth_date": "2000-01-15",
        "date_calendar": "gregorian",
        "calculation_sex": "m",
        "location": {
          "latitude": 30,
          "longitude": 120
        }
      },
      "time_input": {
        "precision": "minute",
        "start": "2000-01-15T12:00:00",
        "end": null,
        "branch_label": null,
        "timezone_name": null,
        "utc_offset_hours": 8,
        "fold": null,
        "clock_basis": "civil"
      }
    },
    "calendar": "gregorian",
    "precision": "minute",
    "location": {
      "latitude": 30.0,
      "longitude": 120.0,
      "source": "coordinates"
    },
    "timezone": {
      "name": null,
      "resolution": "explicit_offset",
      "utc_offset_hours": 8.0,
      "fold": null
    },
    "utc_instant": "2000-01-15T04:00:00Z",
    "term_datetime": "2000-01-15T12:00:00.000000",
    "local_mean_datetime": "2000-01-15T12:00:00.000000",
    "local_apparent_datetime": "2000-01-15T11:50:53.975650",
    "equation_of_time_seconds": -546.0243500422757,
    "candidate_intervals": [
      {
        "start_utc": "2000-01-15T04:00:00Z",
        "end_utc": "2000-01-15T04:00:00Z",
        "utc_offset_hours": 8.0,
        "fold": null
      }
    ],
    "analysis_as_of": "2026-01-15",
    "methods": {
      "solar_time": "Swiss Ephemeris time_equ(jd_ut)",
      "term_timezone": "fixed UTC+08:00",
      "dependency": "pyswisseph"
    },
    "limitations": []
  },
  "methods": {
    "bundle_schema": 2,
    "time_pipeline": "normalize_birth_time",
    "time_rule": "civil/local solar time from one UTC instant; term axis fixed UTC+08:00",
    "zi_hour_rule": "midnight",
    "house_system": "placidus",
    "analysis_as_of": "2026-01-15"
  },
  "dimensions": {
    "bazi": {
      "status": "ok",
      "data": {
        "公历": "2000-01-15T11:50:53",
        "节气时间轴": "2000-01-15T12:00:00",
        "农历": "一九九九年腊月初九",
        "子时规则": "midnight",
        "四柱": [
          {
            "柱": "年柱",
            "干支": "己卯",
            "天干": "己",
            "地支": "卯",
            "纳音": "城头土",
            "天干十神": "正官",
            "地支藏干十神": [
              "伤官"
            ]
          },
          {
            "柱": "月柱",
            "干支": "丁丑",
            "天干": "丁",
            "地支": "丑",
            "纳音": "涧下水",
            "天干十神": "正财",
            "地支藏干十神": [
              "正官",
              "劫财",
              "正印"
            ]
          },
          {
            "柱": "日柱",
            "干支": "壬申",
            "天干": "壬",
            "地支": "申",
            "纳音": "剑锋金",
            "天干十神": "日主",
            "地支藏干十神": [
              "偏印",
              "比肩",
              "七杀"
            ]
          },
          {
            "柱": "时柱",
            "干支": "丙午",
            "天干": "丙",
            "地支": "午",
            "纳音": "天河水",
            "天干十神": "偏财",
            "地支藏干十神": [
              "正财",
              "正官"
            ]
          }
        ],
        "日主": {
          "天干": "壬",
          "五行": "水",
          "意象": "江河大海 · 智慧流通 · 奔流不息"
        },
        "五行权重": {
          "木": 1.0,
          "火": 2.7,
          "土": 2.0,
          "金": 0.7,
          "水": 1.6
        },
        "五行比例": {
          "木": 12.5,
          "火": 33.8,
          "土": 25.0,
          "金": 8.8,
          "水": 20.0
        },
        "五行统计口径": "四柱天干+藏干固定权重；非实测能量",
        "调候用神": {
          "用神": "丙·丁·甲",
          "reason": "严冬之水，专用丙火解冻"
        },
        "神煞": {
          "年柱": [
            "天乙贵人"
          ],
          "月柱": [
            "金舆",
            "寡宿"
          ],
          "日柱": [
            "太极贵人",
            "劫煞"
          ],
          "时柱": [
            "灾煞"
          ]
        },
        "起运": {
          "status": "ok",
          "method": "sect1",
          "start": "3年0月10天",
          "start_date": "2003-01-25"
        },
        "大运": [
          {
            "干支": "丙子",
            "起始年龄": 4,
            "终止年龄": 13,
            "起始公历年": 2003,
            "终止公历年": 2012
          },
          {
            "干支": "乙亥",
            "起始年龄": 14,
            "终止年龄": 23,
            "起始公历年": 2013,
            "终止公历年": 2022
          },
          {
            "干支": "甲戌",
            "起始年龄": 24,
            "终止年龄": 33,
            "起始公历年": 2023,
            "终止公历年": 2032
          },
          {
            "干支": "癸酉",
            "起始年龄": 34,
            "终止年龄": 43,
            "起始公历年": 2033,
            "终止公历年": 2042
          },
          {
            "干支": "壬申",
            "起始年龄": 44,
            "终止年龄": 53,
            "起始公历年": 2043,
            "终止公历年": 2052
          },
          {
            "干支": "辛未",
            "起始年龄": 54,
            "终止年龄": 63,
            "起始公历年": 2053,
            "终止公历年": 2062
          },
          {
            "干支": "庚午",
            "起始年龄": 64,
            "终止年龄": 73,
            "起始公历年": 2063,
            "终止公历年": 2072
          },
          {
            "干支": "己巳",
            "起始年龄": 74,
            "终止年龄": 83,
            "起始公历年": 2073,
            "终止公历年": 2082
          }
        ],
        "流年": [
          {
            "year": 2026,
            "干支": "丙午",
            "year_boundary": "立春",
            "validity": {
              "start": "2026-02-04T04:02:08+08:00",
              "end": "2027-02-04T09:46:18+08:00",
              "timezone": "UTC+08:00",
              "source": "lunar-python solar-term table"
            }
          }
        ],
        "流月查询": [],
        "空亡": {
          "年柱空亡": "申酉",
          "日柱空亡": "戌亥"
        },
        "胎元": "戊辰",
        "命宫": "甲戌",
        "节气警告": null,
        "sxtwl_交叉校验": {
          "date": "2000-01-15",
          "sxtwl_day_ganzhi": "壬申",
          "precision": "date-level only; not an independent hour/month adjudication"
        }
      },
      "candidates": [],
      "limitations": []
    },
    "ziwei": {
      "status": "ok",
      "data": {
        "基础信息": {
          "公历日期": "2000-1-15",
          "农历日期": "一九九九年腊月初九",
          "四柱": "己卯 丁丑 壬申 丙午",
          "出生时辰": "午时",
          "时辰范围": "11:00~13:00",
          "太阳星座": "摩羯座",
          "生肖": "兔",
          "命宫地支": "未",
          "身宫地支": "未",
          "命主": "武曲",
          "身主": "天同",
          "五行局": "土五局"
        },
        "十二宫": [
          {
            "宫位": "疾厄宫",
            "地支": "寅",
            "天干": "丙",
            "是否身宫": false,
            "是否来因宫": false,
            "主星": [
              {
                "名称": "紫微",
                "亮度": "旺",
                "四化": "",
                "类型": "major"
              },
              {
                "名称": "天府",
                "亮度": "庙",
                "四化": "",
                "类型": "major"
              }
            ],
            "辅星": [],
            "杂耀": [
              {
                "名称": "天福",
                "亮度": "",
                "四化": "",
                "类型": "adjective"
              },
              {
                "名称": "天月",
                "亮度": "",
                "四化": "",
                "类型": "adjective"
              },
              {
                "名称": "天使",
                "亮度": "",
                "四化": "",
                "类型": "adjective"
              }
            ],
            "长生十二神": "病",
            "博士十二神": "将军",
            "将前十二神": "亡神",
            "岁前十二神": "病符",
            "小限年龄": [
              2,
              14,
              26,
              38,
              50,
              62,
              74,
              86,
              98,
              110
            ],
            "大限": {
              "范围": [
                55,
                64
              ],
              "天干": "丙",
              "地支": "寅"
            }
          },
          {
            "宫位": "财帛宫",
            "地支": "卯",
            "天干": "丁",
            "是否身宫": false,
            "是否来因宫": false,
            "主星": [
              {
                "名称": "太阴",
                "亮度": "陷",
                "四化": "",
                "类型": "major"
              }
            ],
            "辅星": [
              {
                "名称": "左辅",
                "亮度": "",
                "四化": "",
                "类型": "soft"
              },
              {
                "名称": "火星",
                "亮度": "利",
                "四化": "",
                "类型": "tough"
              }
            ],
            "杂耀": [
              {
                "名称": "八座",
                "亮度": "",
                "四化": "",
                "类型": "adjective"
              },
              {
                "名称": "天哭",
                "亮度": "",
                "四化": "",
                "类型": "adjective"
              }
            ],
            "长生十二神": "衰",
            "博士十二神": "小耗",
            "将前十二神": "将星",
            "岁前十二神": "岁建",
            "小限年龄": [
              3,
              15,
              27,
              39,
              51,
              63,
              75,
              87,
              99,
              111
            ],
            "大限": {
              "范围": [
                45,
                54
              ],
              "天干": "丁",
              "地支": "卯"
            }
          },
          {
            "宫位": "子女宫",
            "地支": "辰",
            "天干": "戊",
            "是否身宫": false,
            "是否来因宫": false,
            "主星": [
              {
                "名称": "贪狼",
                "亮度": "庙",
                "四化": "权",
                "类型": "major"
              }
            ],
            "辅星": [
              {
                "名称": "文昌",
                "亮度": "得",
                "四化": "",
                "类型": "soft"
              },
              {
                "名称": "铃星",
                "亮度": "陷",
                "四化": "",
                "类型": "tough"
              }
            ],
            "杂耀": [
              {
                "名称": "天空",